name,name_location,link,price,price_per_sqft,area,area_type,bedroom,bathroom,description,super_builtup,built_up,carpet_area,config_bedroom,config_bathroom,balcony,additional_rooms,price_text,floor,facing,overlooking,age,address,society,furnish_type,property_id,nearby_locations,furnish_details,features,rating,rating_list,status,Unnamed: 0
NG Park Dahisar East,"2 BHK House for sale in Dahisar East, Mumbai",https://www.99acres.com/2-bhk-bedroom-apartment-flat-for-sale-in-ng-park-dahisar-east-dahisar-east-mumbai-andheri-dahisar-550-sq-ft-r1-spid-P79960933,₹85 Lac,"₹15,454 /sqft",550 sqft,Carpet Area,2 BHK,2  Baths,Resale 2bhk registred society with clear title oc 24x7 water electricity building with lift pipe gas connection loan possible from any bank avaible for unbelievable price 85 lakhs only.,,,550.0,2 Bedrooms,2 Bathrooms,No Balcony,,85 Lac,1st   of 7 Floors,North,Others,5 to 10 Year Old,"NG Park Dahisar East Dahisar East, Mumbai",,,P79960933,"['Thakur Shopping Mall & Multiplex', 'Gurdwara', 'Vithal Rakhumai Mandir', 'Hanuman Temple', 'Icici bank ATM', 'Hdfc ATM', 'Shraddha Hospital Mumbai', 'Akshit Maternity Home', 'Ashirwad Maternity and Nursing Home', 'Aashapuri Hospital', 'Rohit Nursing Home - Dahisar', 'Sanghavi Eye and Diabetes Care Center', 'Kk Maternity and General Hospital', 'Kumar Hospital and Polyclinic', 'Navneet Hi-Tech Hospital', 'Navdurga Fracture and Accident Centre', 'Jai Ambe Poly Clinic Nursing Home and Maternity Hospital', 'Vijay Polyclinic and Care Centre', 'Namitha Polyclinic and Hospital', 'Vishwanath Hospital Mumbai', ""Dr Worlikar's Shree Surgical and General Nursing Home"", 'Ashok Hospital', 'Chiranjeev Childrens Hospital', 'Sai Kripa Pediatric Hospital', 'Mauli Hospital Mumbai', 'Sohum Eyecare Centre', 'Total Woman Medical Centre - Dahisar', 'Meeti Lifeline Hospital', 'Elite Hospital - Mumbai - Borivali W', 'Netra Mandir', 'Chandra Maternity Hospital', 'Ameya Orthopaedic Centre', ""Dr. Mehta's Maternity Home"", ""Neerja Children's Hospital"", 'Purnima Hospital', 'Mandapeshwar Hospital and Clinics', 'Arihant Eye Care Centre Borivali', 'Bhaktivedanta Hospital', 'Kini Nursing Home', 'Gandhi Nursing Home-Borivali-Mumbai', 'HP Petrol Pump', 'Hdfc bank', 'Bank of baroda', 'Kanataka bank', 'HOTEL KALASH', 'Riga chinese', 'Anand Nagar Municipal School', 'Vidhyamandir School', 'Rustomjee Cambridge International school', 'Dahisar railway station']",[],"['Feng Shui / Vaastu Compliant', 'Security / Fire Alarm', 'Lift(s)', 'Maintenance Staff', 'Water Storage', 'Piped-gas']",4.3,"{'Lifestyle': 4.2, 'Connectivity': 4.5, 'Environment': 4.2, 'Safety': 4.2}",Ready To Move,26.0
Indiabulls Blu,"5 BHK House for sale in Worli, Mumbai",https://www.99acres.com/5-bhk-bedroom-apartment-flat-for-sale-in-indiabulls-blu-worli-south-mumbai-3300-sq-ft-spid-G81705080,₹33 Cr,"₹100,000 /sqft","3,300 sqft",Carpet Area,5 BHK,6  Baths,"Indiabulls blu is one of mumbai south's most sought-After destinations for apartments, and this 5 bhk flat in worli is your opportunity to be a part of this community. Containing 5 bedroom(s) and 6 bathrooms , this flat is spread over a carpet area of 3300 sq. Ft. This flat lies on the 35th level of a 56-Story building. This 1-5-Year-Old property is available for immediate possession as the pro...",,,,,,,,,,,,,,,,,[],[],[],,{},Ready To Move,27.0
Vasant Park CHS,"2 BHK House for sale in Khadakpada, Kalyan West",https://www.99acres.com/2-bhk-bedroom-apartment-flat-for-sale-in-vasant-park-chs-khadakpada-mumbai-beyond-thane-850-sq-ft-spid-W80878873,₹75 Lac,"₹12,500 /sqft",850 sqft,Super Built-up Area,2 BHK,2  Baths,"Located in the popular residential address of khadakapda , thane outskirts, vasant park chs is one of the most preferred destination for apartments in thane outskirts. This 2 bhk flat is your ticket to be a part of this community. This property faces the south-East direction. Constructed on a super built up area of 850 sq.Ft., the flat comprises 2 bedroom(s), 2 bathrooms . This flat lies on the...",,,,,,,,,,,,,,,,,[],[],[],,{},Ready To Move,28.0
Shagun White Nest,"1 BHK House for sale in Ulwe, Navi Mumbai",https://www.99acres.com/1-bhk-bedroom-apartment-flat-for-sale-in-ulwe-navi-mumbai-690-sq-ft-spid-B80696275,₹70 Lac,"₹10,144 /sqft",690 sqft,Super Built-up Area,1 BHK,2  Baths,"This 1 bhk flat is located in shagun white nest, which houses some of the most spacious flats in ulwe, navi mumbai. The flat is north-East-Facing. The flat occupies a super built up area of 690 sq.Ft. That consists of 1 bedroom, 2 bathrooms and 3 balconies. The property is located on the 7th floor of a 11 floors tall building. Being a ready to move project, you can expect immediate possession o...",,,,,,,,,,,,,,,,,[],[],[],,{},Ready To Move,29.0
Mahajan Oza,"2 BHK House for sale in Naupada, Thane West",https://www.99acres.com/2-bhk-bedroom-apartment-flat-for-sale-in-naupada-mumbai-thane-900-sq-ft-r6-spid-M73561749,₹1.45 Cr,"₹24,166 /sqft",900 sqft,Super Built-up Area,2 BHK,2  Baths,"On request is one of thane's most sought after destination for apartments and this 2 bhk flat in naupada is your opportunity to be a part of this community. The flat is east-Facing. Constructed on a super built up area of 900 sq. Ft., the flat comprises 2 bedroom(s), 2 bathrooms . This flat is situated on the 3rd floor of this 7 floors tall residential building. This is a ready to move project ...",,,,,,,,,,,,,,,,,[],[],[],,{},Ready To Move,30.0
Shivnta,"3 BHK House for sale in Panch Pakhadi, Thane West",https://www.99acres.com/3-bhk-bedroom-apartment-flat-for-sale-in-panch-pakhadi-mumbai-thane-950-sq-ft-spid-D81594071,₹2 Cr,"₹21,052 /sqft",950 sqft,Carpet Area,3 BHK,2  Baths,Availble ( 1 bhk+ 1 bhk ) 3 bhk flat for sell at near tmc panch pakhadi thane west. 2 small terrace available. Its a middle floor. As per vastu complain flat. 1 open car parking available. If you want more details lease call me.,,,950.0,3 Bedrooms,2 Bathrooms,2 Balconies,Store Room,2 Crore,4th   of 6 Floors,East,Main Road,10+ Year Old,"Shivnta  Panch Pakhadi, Thane West",,Unfurnished,D81594071,"['Nuri Baba Darga', 'Dr Subodh Mehtas Advance Orthopedic and Joint Replacement Center', 'Bapat Nursing Home', ""Dr. Lad's Orthodontics Clinic"", ""Dr Uppal's ENT Hospital & Sonic Hearing & Speech Centre"", 'Chiranjeevi Hospital', ""Dr. Uppal's Ent Hospital Thane"", 'Dhanvantri Childrens Hospital', 'Aayush Hospital Thane', 'Sushrut Nursing Home', 'Aadhar Hospital', 'Unnati Critical Care Unit and I.C.C.U', 'Dr. Sapatnekar Hospital I.C.C.U and Polyclinic', 'Aasha Cancer Hospital and Children First', 'Thane Eye Care Hospital', 'Gunjotikar Nursing Home', 'Shweta Nursing Home', 'Kaushalya Medical Foundation Trust Hospital Mumbai', 'Orhtocare Hospital', 'Bodas Surgical and Maternity Home', 'More Eye Center', 'Vartak Nursing Home', 'Dr.Nalavade Multispeciality Hospital', 'Shivneri Hospital Pvt. Ltd.', 'Hi-Tech Urology Centre', 'Koshti Maternity and Surgical Hospital', 'Medicare Hospital Thane', 'Dr Gadgil Eye Clinic and Lasik Laser Centre', 'Sahayog Nursing Home', 'MEDICARE HOSPITAL', 'Dr. Paranjpes Eye Clinic', 'Criticare Superspeciality Hospital', 'Risk Care Hospital and Iccu', 'Shree Ramkrishna Netralaya', 'Abhimaan Maternity and Surgical Hospital - Thane', 'HIGHWAY HOSPITAL', 'Wellness Forever', 'Vandana ST Bus Depot', 'Bank of maharashtra', 'Hdfc bank', 'Union bank', 'Vandana Talkies', 'Pizza Hut', 'Dhiraj Hotel', 'Pappu Da Dhaba', 'Tenzo Temple', 'Thane Cafe', 'Gajanan Snack Center', 'Saiemaas', 'Compubee Technologies']",[],"['Security / Fire Alarm', 'Lift(s)', 'Water Storage', 'No open drainage around', 'Piped-gas', 'Visitor Parking', 'Security Personnel', 'Natural Light', 'Airy Rooms']",4.2,"{'Lifestyle': 4.2, 'Connectivity': 4.2, 'Environment': 3.9, 'Safety': 4.2}",Ready To Move,31.0
Siddhivinayak Signature City,"1 BHK House for sale in Taloja, Navi Mumbai",https://www.99acres.com/1-bhk-bedroom-apartment-flat-for-sale-in-siddhivinayak-signature-city-taloja-navi-mumbai-448-sq-ft-to-464-sq-ft-npspid-G80222971,₹40  - 41 Lac,"₹8,882 /sqft",448-464 sqft,Carpet Area,1 BHK,,"Live in a world of comfort and style at Siddhivinayak Signature City, located in Taloja, Navi Mumbai. Book your 1 BHK apartment now. Sprawling across a carpet area of 448.0 sq. ft. - 464.0 sq. ft., these are an under construction apartments. These are available at a price range of Rs. 40 Lac to Rs. 41 Lac. All the 3 towers have with aesthetically crafted interiors as well as exteriors. The proj...",,,,,,,,,,,,,,,,G80222971,"['Taloja Panchnand', 'Pendhar Metro Station', 'Paradise Mall', 'Mumbra - Panvel Hwy', 'The West Hills High INT School', 'ITM Skills University', 'Kharghar Multispeciality Hospital', 'CSMI Airport', 'Millennium Business Park', 'Royal Tulip Hotel', 'Wonders Park', 'Kharghar Valley Golf Course', 'D Y Patil Sports Stadium', 'Karave beach']",[],[],4.1,"{'Lifestyle': 4.1, 'Connectivity': 4.1, 'Environment': 3.9, 'Safety': 4.1}",Under Construction,32.0
Kukreja Plaza,"2 BHK House for sale in Sector 11 Belapur, Navi Mumbai",https://www.99acres.com/2-bhk-bedroom-apartment-flat-for-sale-in-kukreja-plaza-sector-11-belapur-navi-mumbai-940-sq-ft-r3-spid-K76883547,₹1.55 Cr,"₹16,489 /sqft",940 sqft,Super Built-up Area,2 BHK,2  Baths,"Kukreja plaza is one of the most popular destination for buying apartments/ flats in sector 11 belapur, navi mumbai. You too can be a part of this society by purchasing this 2 bhk flat here. This residential flat is north-East-Facing direction. Constructed on a super built up area of 940 sq.Ft., the flat comprises 2 bedroom(s), 2 bathrooms and 2 balconies. This flat lies on the 4th level of a 1...",,,,,,,,,,,,,,,,,[],[],[],,{},Ready To Move,33.0
Asmi Garden,"1 BHK House for sale in Tilak nagar, Chembur",https://www.99acres.com/1-bhk-bedroom-apartment-flat-for-sale-in-asmi-garden-tilak-nagar-central-mumbai-487-sq-ft-spid-Q81627063,₹1.2 Cr,"₹24,640 /sqft",487 sqft,Carpet Area,1 BHK,2  Baths,"Available spacious 1bhk for sale
Higher floor
Oc received 
Rental income - 42k",,,,,,,,,,,,,,,,,[],[],[],,{},Ready To Move,34.0
Jade park,"3 BHK House for sale in Juhu, Mumbai",https://www.99acres.com/3-bhk-bedroom-apartment-flat-for-sale-in-juhu-western-mumbai-1200-sq-ft-spid-E81686858,₹6 Cr,"₹50,000 /sqft","1,200 sqft",Carpet Area,3 BHK,3  Baths,"Jade park epitomizes the essence of luxury living, perfectly reflected in a vibrant and close-Knit community. Nestled in the heart of vile parle west, this unique gem sets a new standard for residential excellence. It harmoniously blends elegant living spaces with an array of luxurious lifestyle amenities, offering a life of sophistication and comfort. Spanning 3 acres of low-Density redevelopm...",,,1200.0,3 Bedrooms,3 Bathrooms,2 Balconies,Store Room,6 Crore,7th   of 15 Floors,East,"Pool,Park/Garden,Club,Main Road",Dec 2029,"Jade park Juhu, Mumbai",,Unfurnished,E81686858,"['Juhu Church', 'Jain Derasar Temple', 'Sunridges Speciality Hospital', 'Dr.Daftarys Total Care Clinic', 'The Vission Eye Centre', 'Sunflower Nursing Home Mumbai', 'Dr Sanjay Soni Dental Clinic', 'Iris Eye Center', 'Khandwala Eye Hospital and Polyclinic', 'Shruti Clinic', 'Lotus Eye Hospital', 'Nanavati Hospital Mumbai', 'Indian Oil', 'Axis bank', 'Bank of india', 'Kotak mahindra bank', 'Union bank of india', 'Prithvi Theatre', 'Starbucks', 'Shiv Sagar', 'Mahesh Lunch Home', 'Bora Bora', 'NMIMS canteen', 'Guru Saagar', 'Mahalakshmi', 'Radhe Krishna', 'Mumbai Fun In', 'anand dosa center', ""Domino's Pizzas"", 'Shree Siddhivinayak Fast Food', 'Shiv Shankar Bhel Puri & Chat Centre', 'Sai Kalyan Pav Bhaji & Chinese', 'Arun Fast Food Centre', 'Rangeela Rajasthan Fast Food', 'Rajasthan Pav Bhaji', 'Sagar Vada Pav & Tea', 'Shree Ram Pav Bhaji', 'Kitchen Garden', 'Poetry', ""Alfredo's"", 'Don Giovanni', 'Prithvi Cafe', 'Cafe Coffee Day', 'Riverside Rose', ""McDonald's"", 'Facing East', 'Jamnabai Narsee School', 'NMIMS', 'Mithibai College', 'Dwarkadas J Sanghvi College of Engineering']",[],"['Water purifier', 'Centrally Air Conditioned', 'Security / Fire Alarm', 'Feng Shui / Vaastu Compliant', 'Private Garden / Terrace', 'Intercom Facility', 'Lift(s)', 'High Ceiling Height', 'Maintenance Staff', 'False Ceiling Lighting', 'Water Storage', 'Separate entry for servant room', 'No open drainage around', 'Bank Attached Property', 'Piped-gas', 'Internet/wi-fi connectivity', 'Recently Renovated', 'Visitor Parking', 'Swimming Pool', 'Park', 'Security Personnel', 'Natural Light', 'Airy Rooms', 'Spacious Interiors', 'Low Density Society', 'Waste Disposal', 'Rain Water Harvesting', 'Water softening plant', 'Shopping Centre', 'Fitness Centre / GYM', 'Club house / Community Center']",4.4,"{'Lifestyle': 4.5, 'Connectivity': 4.4, 'Environment': 4.1, 'Safety': 4.2}",Under Construction,35.0
Omkar Alta Monte and Signet,"3 BHK House for sale in Malad East, Mumbai",https://www.99acres.com/3-bhk-bedroom-apartment-flat-for-sale-in-omkar-alta-monte-and-signet-malad-east-mumbai-andheri-dahisar-1680-sq-ft-spid-L81628195,₹4.29 Cr,"₹25,535 /sqft","1,680 sqft",Built-up Area,3 BHK,3  Baths,"This beautiful 3 bhk flat in malad east, western mumbai is situated in omkar alta monte, one of the popular residential society in western mumbai. This property faces the east direction. The flat occupies a built up area of 1680 sq.Ft. That consists of 3 bedrooms, 3 bathrooms and 3 balconies. This flat is situated on the 49th floor of this 62 floors tall residential building. Being a ready to m...",,1680.0,1230.0,3 Bedrooms,3 Bathrooms,3 Balconies,"Pooja Room,Servant Room,Others,Study Room",4.29 Crore,49   of 62 Floors,South-West,"Pool,Main Road,Park/Garden,Others,Club,Sea facing",1 to 5 Year Old,"Omkar Alta Monte and Signet Malad East, Mumbai",,Semifurnished,L81628195,"['Big Bazzar Kandivali', 'Panchasar derasar', 'Ratnapuri Jain Mandir', 'Durga Mata Mandir', 'Shivling', 'Hdfc ATM', 'Suvidha Hospital and Iccu', 'Hyat Hosptal', 'Aastha Maternity', 'Bittoo Clinic', 'Balajee Hospital', 'New Nari Hospital', 'Sai Krupa Hospital Mumbai', 'Sai Swayam MatandNur Home', 'Kairav Nursing Home', 'Shree Ram Shyam Clinic', 'Megha Surgical Hospital', 'Jeevan Maternity and Genral Hospital', ""Dr. Sharik's Asha Maternity & General Hospital"", 'Raj Nursing Home Mumbai', 'Sanjeevani Surgical and General Hospital', 'S.K.Patil Hospital', 'Shraddha Orthopedic and Surgical Hospital', 'Agrawal Clinic', 'Shukla Diagnostic and Healthcare Centre', 'Anandpara Surgical and General Hospital', 'Suresh Eye Clinic', 'Sanjeevani Chandrabhan Agrawal Charitable Trust Eye Hospital', 'Enclave Maternity Home', 'Shree Sai Clinic', 'Tushar Maternity and Surgical Nursing Home', 'Shah Eye Clinic and Microsurgery Centre', 'Sai Clinic and Day Care Centre', 'Krishna Eye Care Centre', 'Royal Health Care Pvt Ltd', 'M.W. Desai Municipal General Hospital', 'Kanchi Nursing Home', 'Dr. Nirmal Clinic', 'Sudha Hospital and Polyclinic Mumbai', 'Suchak Hospital', 'Devangi Hospital', 'Quest Multispeciality Clinic', 'Pawar Fast Food', 'Caffe Coffee Day', 'St. George High School', 'St. Joseph High School', 'Sharda Gyanpeeth International School', 'Universal High School', 'Yashodham High School & Jr. College', 'Malad railway station']","['1 Water Purifier', '5 Fan', '1 Exhaust Fan', '1 Dining Table', '3 Geyser', '1 Stove', '15 Light', '1 Modular Kitchen', '5 AC', '1 Curtains', '1 Chimney', '3 Wardrobe', '1 Microwave']","['Security / Fire Alarm', 'Feng Shui / Vaastu Compliant', 'Intercom Facility', 'Lift(s)', 'High Ceiling Height', 'Maintenance Staff', 'Water Storage', 'Piped-gas', 'Visitor Parking', 'Swimming Pool', 'Park', 'Natural Light', 'Airy Rooms', 'Fitness Centre / GYM', 'Waste Disposal', 'Rain Water Harvesting', 'Club house / Community Center']",4.3,"{'Lifestyle': 4.2, 'Connectivity': 4.4, 'Environment': 4.0, 'Safety': 4.2}",Ready To Move,36.0
off Bandstand Rd,"1 BHK House for sale in Bandra West, Mumbai",https://www.99acres.com/1-bhk-bedroom-apartment-flat-for-sale-in-bandra-west-western-mumbai-500-sq-ft-spid-J81693186,₹4 Cr,"₹80,000 /sqft",500 sqft,Carpet Area,1 BHK,1  Bath,"Spacious, ready to move in luxury 1 bhk apartment for sale in a very well maintained building located in a posh area at mount mary, bandra west.It is a bright and breezy apartment on the middle floor with sea views and lots of natural light throughout the day. It has 1 reserved car parking space. Building has a round the clock security with intercom and cameras, lobby area, high speed elevators...",,,,,,,,,,,,,,,,,[],[],[],,{},Ready To Move,37.0
Sai Proviso Apartment,2 BHK House for sale in Sector 20 Kopar Khairane,https://www.99acres.com/2-bhk-bedroom-apartment-flat-for-sale-in-sai-proviso-apartment-sector-20-kopar-khairane-navi-mumbai-1100-sq-ft-spid-F81291409,₹1.65 Cr,"₹15,000 /sqft","1,100 sqft",Built-up Area,2 BHK,2  Baths,"Check out this 2 bhk apartment for sale in sai proviso apartment, a popular residential project that houses in-Demand flats in sector 20 kopar khairane, navi mumbai. The flat is south-East-Facing. The flat occupies a built up area of 1100 sq.Ft. That consists of 2 bedrooms, 2 bathrooms and 1 balcony. This flat lies on the 4th level of a 10 storey building. This 10+ years old property is availab...",,,,,,,,,,,,,,,,,[],[],[],,{},Ready To Move,38.0
Hiranandani Lightbridge,"3 BHK House for sale in Hiranandani Meadows, Manpada",https://www.99acres.com/3-bhk-bedroom-apartment-flat-for-sale-in-hiranandani-lightbridge-hiranandani-meadows-mumbai-thane-2150-sq-ft-r17-spid-C63024150,₹4.15 Cr,"₹19,302 /sqft","2,150 sqft",Super Built-up Area,3 BHK,3  Baths,"Explore your dream home 3 bhk flat for sale in hiranandani lightbridge, thane We are delighted to present an excellent opportunity to purchase a beautiful 3 bhk flat in the prestigious hiranandani lightbridge located in the serene hiranandani meadows, thane. Key features: 3 bedrooms spacious, well-Ventilated, and designed for comfort. West-Facing enjoy beautiful sunsets and natural light throug...",,,,,,,,,,,,,,,,,[],[],[],,{},Ready To Move,39.0
Veena Synergy,"2 BHK House for sale in Andheri East, Mumbai",https://www.99acres.com/2-bhk-bedroom-apartment-flat-for-sale-in-veena-synergy-andheri-east-mumbai-andheri-dahisar-691-sq-ft-to-699-sq-ft-npspid-V81514955,₹2.16  - 2.16 Cr,"₹31,050 /sqft",691-699 sqft,Carpet Area,2 BHK,,"Live in a world of comfort and style at Veena Synergy, located in Andheri East, Western Mumbai. Book your 2 BHK apartment now. Sprawling across a carpet area of 691.0 sq. ft. - 699.0 sq. ft., these are an under construction apartments. These are available at a price range of Rs. 2.16 Crore to Rs. 2.16 Crore. All the 3 towers have with aesthetically crafted interiors as well as exteriors. The pr...",,,,,,,,,,,,,,,,,[],[],[],,{},Under Construction,40.0
Nano City,"1 BHK House for sale in Badlapur East, Thane",https://www.99acres.com/1-bhk-bedroom-apartment-flat-for-sale-in-nano-city-badlapur-east-mumbai-beyond-thane-400-sq-ft-to-429-sq-ft-npspid-D81484357,₹22.95  - 24.49 Lac,"₹5,724 /sqft",400-429 sqft,Carpet Area,1 BHK,,"Enjoy a blissful living experience in Nano City. This residential project encompasses 1 BHK flats in Badlapur East, Thane Outskirts and brings you the best of both the worlds – excellent aesthetics and exemplary lifestyle. Its unique highlights include facilities like Fire Fighting Systems, Power Back up Lift, Landscape Garden, 24x7 Security, Gymnasium and many others. All of these and the othe...",,,,,,,,,,,,,,,,,[],[],[],,{},Under Construction,41.0
Prescon Prestige Residency,"1 BHK House for sale in Waghbil, Thane West",https://www.99acres.com/1-bhk-bedroom-apartment-flat-for-sale-in-prescon-prestige-residency-waghbil-mumbai-thane-552-sq-ft-r9-spid-A65586020,₹53 Lac,"₹9,166 /sqft",552 sqft,Super Built-up Area,1 BHK,2  Baths,"1bhk urgent sale in waghil naka ghodbunder road thane west Prescon prestige residency is one of the most popular destination for buying apartments/ flats in waghbil, mumbai thane. You too can be a part of this society by purchasing this 1 bhk flat here. Constructed on a super built up area of 756 sq.Ft., the flat comprises 1 bedroom(s), 2 bathrooms and 1 balcony. The flat has a total of 7 floor...",,,,,,,,,,,,,,,,,[],[],[],,{},Ready To Move,42.0
Sai Siddhi Sai Plaza,"1 BHK House for sale in Kalyan East, Thane",https://www.99acres.com/1-bhk-bedroom-apartment-flat-for-sale-in-sai-siddhi-sai-plaza-kalyan-east-mumbai-beyond-thane-545-sq-ft-npspid-Q81700976,₹35 Lac,"₹6,422 /sqft",545 sqft,Super Built-up Area,1 BHK,,"Book your 1 BHK apartment in Sai Siddhi Sai Plaza, Kalyan East, Thane Outskirts. Having a super built-up area of 545.0 sq. ft., the property is well ventilated and promises an exclusive view and refreshing vibes. The project is a superbly designed project set amidst excellent surroundings and offers residents a world-class infrastructure. Look at its range of general amenities that include Vast...",,,,,,,,,,,,,,,,Q81700976,"['Kalyan Junction', 'Metro Junction Mall', 'NH-61', 'Jaydev English High School', 'Saket College Of Art,Science & Commerce', 'Fortis Hospital Kalyan', 'Sonal Business Park', 'LODHA Golflinks']",[],[],4.1,"{'Lifestyle': 4.0, 'Connectivity': 4.3, 'Environment': 3.8, 'Safety': 4.1}",Ready To Move,43.0
GAMI MAFCO,"3 BHK House for sale in Sanpada, Navi Mumbai",https://www.99acres.com/3-bhk-bedroom-apartment-flat-for-sale-in-sanpada-navi-mumbai-1635-sq-ft-spid-H81702944,₹1.99 Cr,"₹12,171 /sqft","1,635 sqft",Super Built-up Area,3 BHK,3  Baths,"This beautiful 3 bhk flat in sanpada, navi mumbai is situated in gami mafco, one of the popular residential society in navi mumbai. The flat is facing the east direction. The floor plan additionally contains 3 bedroom(s), 3 bathrooms and more than 3 balconies. All in all, the flat is spread over a super built up area of 1635 sq.Ft. The property is located on the 18th floor of a 21 floors tall b...",1635.0,1600.0,1550.0,3 Bedrooms,3 Bathrooms,3+ Balconies,"Pooja Room,Study Room,Store Room",1.99 Crore,18th   of 21 Floors,East,Main Road,Dec 2027,"GAMI MAFCO Sanpada, Navi Mumbai",,Unfurnished,H81702944,"['Inorbit Mall', 'Sri Akhandananda Ashram', 'Corporation bank ATM', ""Dr. R.N. Patil's Suraj Neurologiacal and Multispeciality Hospital"", 'Sanpada General Hopital', 'Millennium Life Line Hospital and Research Centre', 'Mangal Prabhu Nursing Home Polyclinic and Diagnostic Center', 'Navjeevan Hospital', 'Dr. Tilwe Maternity and Nursing Home', 'Surya Netralaya', 'Thanawalas Maternity Home & IVF Clinic', 'Dhrushti Eye Clinic and Microsourgery Centre', 'Zaveri Eye Clinic', 'Dr. Parikhs Nursing Home and Iccu -', 'Thanawala Maternity Home', 'Sushrusha Heart Care Center and Speciality Hospital', 'Kamlesh Mother and Child Hospital', 'Manak Healthcare Hospital', 'Laksh Deep Hospital', 'Lotus Multispeciality Hospital and Icu', 'Chaitanya Child Care Centre', 'Ojas Nursing Home', 'Sanjivani Hospital and Iccu', 'Aryan Hospital', 'Harish Hospital and Iccu', 'Pkc Hospital', 'Global 5 Health Care Centre', 'Sterling Wockhardt Hospital', 'Mohanlal Jivandas Hospital managed by Krishnai Hospital', 'Vashi', 'Nerul L.P', 'Mahanagar Gas', 'State bank of india', 'The maharashtra state co-operative bank ltd', 'Hdfc bank', 'Vishnudas Bhave Natyagruha', 'Bhaghat Tarachand', ""McDonald's"", 'Hotel Golden Punjab', 'Navratna Veg Restaurant -', ""Domino's"", 'Hotel Shabari', 'Royal Oak Brewery', 'Sanpada railway station', 'Juinagar railway station', 'Vashi railway station', 'Turbhe railway station', 'Haware Business Park', 'Commtel Networks', 'Cht.sahu maharaj vachnalaya library']",[],"['Security / Fire Alarm', 'Intercom Facility', 'Lift(s)', 'Maintenance Staff', 'Swimming Pool', 'Water Storage', 'Park', 'Piped-gas', 'Visitor Parking', 'Internet/wi-fi connectivity', 'Fitness Centre / GYM', 'Rain Water Harvesting']",4.5,"{'Lifestyle': 4.4, 'Connectivity': 4.5, 'Environment': 4.4, 'Safety': 4.4}",Under Construction,44.0
Rustomjee Crown,"4 BHK House for sale in Prabhadevi, Mumbai",https://www.99acres.com/4-bhk-bedroom-apartment-flat-for-sale-in-rustomjee-crown-prabhadevi-south-mumbai-2900-sq-ft-spid-T81686766,₹15 Cr,"₹51,724 /sqft","2,900 sqft",Super Built-up Area,4 BHK,4  Baths,"Rustomjee crown is a premium residential project in prabhadevi, south mumbai. It offers 3 & 4 bhk jodi apartments with high ends amenities. Each home provides a beautiful view, allowing owners to relax after a long day of work. Rustomjee crown has two high-Rise towers, spread across 5.75 acres. The estate is filled with delightful surprises, including peaceful terraces, tranquil pools, and sere...",,,,,,,,,,,,,,,,,[],[],[],,{},Ready To Move,45.0
Narayan Resedency,"2 BHK House for sale in Bhaskar Colony, Thane West",https://www.99acres.com/2-bhk-bedroom-apartment-flat-for-sale-in-bhaskar-colony-mumbai-thane-555-sq-ft-r1-spid-P79373417,₹1.45 Cr,"₹26,126 /sqft",555 sqft,Carpet Area,2 BHK,2  Baths,Availble 2 bhk compact flat for sell at naupada thane west. 1 car parking . Its under construction project. Possession will be february 2025. From thane station hardly 5 to 8 minute walking distance from thane station. If you want more details please call me.,,,,,,,,,,,,,,,,,[],[],[],,{},Under Construction,46.0
SAFE TOWER,"2 BHK House for sale in IC Colony, Borivali West",https://www.99acres.com/2-bhk-bedroom-apartment-flat-for-sale-in-ic-colony-mumbai-andheri-dahisar-1050-sq-ft-spid-H81694500,₹1.45 Cr,"₹13,809 /sqft","1,050 sqft",Super Built-up Area,2 BHK,2  Baths,"This beautiful 2 bhk flat in ic colony, western mumbai is situated in safe tower, one of the popular residential society in western mumbai. This property faces the east direction. Constructed on a super built up area of 1050 sq.Ft., the flat comprises 2 bedroom(s), 2 bathrooms . This flat is situated on the 4th floor of this 11 floors tall residential building. As the project is already ready t...",,,,,,,,,,,,,,,,,[],[],[],,{},Ready To Move,47.0
