name,name_location,link,price,price_per_sqft,area,area_type,bedroom,bathroom,description,super_builtup,built_up,carpet_area,config_bedroom,config_bathroom,balcony,additional_rooms,price_text,floor,facing,overlooking,age,address,society,furnish_type,property_id,nearby_locations,furnish_details,features,rating,rating_list,status,Unnamed: 0
S B TOWER DOMBIVLI,"1 BHK House for sale in Thakurli, Dombivli East",https://www.99acres.com/1-bhk-bedroom-apartment-flat-for-sale-in-thakurli-mumbai-beyond-thane-650-sq-ft-spid-B81744696,₹37.5 Lac,"₹5,769 /sqft",650 sqft,Built-up Area,1 BHK,2  Baths,"S b tower dombivli is a well planned society that offers a pleasant living experience to its residents. This 1 bhk flat in thane outskirts is your opportunity to be a part of this community. The flat is over 650 sq.Ft. Built up area and comes with 1 bedroom(s), 2 bathrooms and 3 balconies. The property is located on the 10th floor of a 28 floors tall building. This residential flat is currently...",,,,,,,,,,,,,,,,,[],[],[],,{},Under Construction,
Sianna Heights,"3 BHK House for sale in IC Colony, Borivali West",https://www.99acres.com/3-bhk-bedroom-apartment-flat-for-sale-in-ic-colony-mumbai-andheri-dahisar-982-sq-ft-r8-spid-D70828570,₹2.75 Cr,"₹28,004 /sqft",982 sqft,Carpet Area,3 BHK,3  Baths,"Looking for a 3 bhk property for sale in mumbai andheri-Dahisar? Buy this 3 bhk flat in sianna heights that is situated in ic colony, mumbai andheri-Dahisar. The flat is east-Facing. Constructed on a carpet area of 982 sq.Ft., the flat comprises 3 bedroom(s), 3 bathrooms and 1 balcony. The residential building has 22 floors in total and the flat for sale is located on the 15th floor. This resid...",,,,,,,,,,,,,,,,,[],[],[],,{},Under Construction,
On Request,"2 BHK House for sale in Vile Parle East, Mumbai",https://www.99acres.com/2-bhk-bedroom-apartment-flat-for-sale-in-vile-parle-east-western-mumbai-891-sq-ft-spid-G81583061,₹3.69 Cr,"₹41,414 /sqft",891 sqft,Carpet Area,2 BHK,2  Baths,"Looking for a 2 bhk property for sale in western mumbai? Buy this 2 bhk flat in on request that is situated in vile parle east, western mumbai. The flat is facing the east direction. Containing 2 bedroom(s), 2 bathrooms and 1 balcony, this flat is spread over a carpet area of 891 sq.Ft. This flat lies on the 2nd level of a 7 storey building. As the project is already ready to move, so you can e...",,,891.0,2 Bedrooms,2 Bathrooms,1 Balcony,,3.69 Crore,2nd   of 7 Floors,East,,5 to 10 Year Old,"On Request Vile Parle East, Mumbai",,Semifurnished,G81583061,"['Jayashree', 'sacred heart church', 'St. Church', 'our lady of health church', 'Mahalaxmi Mandir', 'Hanuman Mandir', 'Saibaba Temple', 'Datta Mandir', 'State bank of india ATM', 'CGHS Dispensary No.14 Vakola', 'Dr. Rane hospital maternity & surgical', 'Navjivan Maternity and Surgical Nursing Home', ""Dr. Raut's Maternity and Surgical Nursing Home"", 'Dattatreya Nursing Home', 'Aseem Orthopaedic Hospital', 'Ashish Maternity and Nursing Home - Vile Parle E', 'Smt. Laxmiben Dharamsi Karsan Gala Eye Hospital', 'Shree Ramnath Eye Care', 'Siddhi Nursing Home', 'Vasudev Eye Clinic', 'Dr. Wagh Maternity Hospital', 'Parle Eye Hospital', 'Babasaheb Gawde Hospital', 'Upadhyaya Nursing Home Mumbai', 'Kalina Hospital', 'Dr.Satish G.Desai', 'Vatsalya Clinic', 'Vivek Pathology Laboratory', 'Day Care Eye Clinic Dr.S.V.Sharma Eye Clini', 'Kiran Hall', 'Suman', 'Parle Provision', 'Sahar Cargo Complex', 'State bank of india branch', 'Axis bank', 'Terminal food court', 'Shiu Sagar', 'Vidharbh Vada Pav', 'Hotel Shree Ganesh', 'Satkar', 'Daffodils', 'Simply South', 'Mohan Farsan', ""St. Charles Girls' High chool ground"", 'Addonics Solutions Pvt. Ltd', 'our lady of health high school', 'Vyas Sangeet Vidyalaya', 'Kalina Campus', 'Santacruz railway station', 'Tilak mandir library']","['2 Bed', '2 Wardrobe', '1 Sofa']","['Security / Fire Alarm', 'Water Storage', 'Piped-gas', 'Security Personnel']",4.4,"{'Lifestyle': 4.3, 'Connectivity': 4.5, 'Environment': 4.2, 'Safety': 4.4}",Ready To Move,
Perry Asterix Sea View,"4 BHK House for sale in Bandra West, Mumbai",https://www.99acres.com/4-bhk-bedroom-apartment-flat-for-sale-in-bandra-west-western-mumbai-1750-sq-ft-r1-spid-B79283171,₹19 Cr,"₹108,571 /sqft","1,750 sqft",Carpet Area,4 BHK,4  Baths,"Premier 4 bhk at perry road bandra west
Carpet area 1750 sqft approximately
With huge garden terrace space
1500 sqm of land parcel
3000 sqft ground floor lobby
1400 sqft gymnasium, 2500 sqft banquet hall, swimming pool, jogging track, net cricket, pickle ball, garden, cafe, barbeque space
Close proximity to hospitals, colleges, railway station and airport",,,1750.0,4 Bedrooms,4 Bathrooms,1 Balcony,"Study Room,Pooja Room,Store Room",19 Crore,11st   of 21 Floors,East,"Pool,Park/Garden,Club,Others",Within 6 months,"Perry Asterix Sea View Bandra West, Mumbai",,Unfurnished,B79283171,"['Bandra Market', 'Mandir', 'Masjid', 'Grotto', 'Ganpati Mandir', 'Standard chartered bank ATM', 'Empire Centre', 'MM Munshi Hospital', 'Dr. Jayprakash Hebbar', 'Parekh Eye Hospital', ""Dr. Shetty's Nursing Home"", 'Mahatma Gandhi Seva Mandir', 'National Centre for Training and Research into Cerebral Palsy', 'Ali Yavar Jung National Institute for the Hearing Handicapped', 'Bandra Medical Stores', 'Shifa Medical and General Store', 'Metro Medicals', 'Noble Plus Pharmacy', 'Union bank of india', 'Standard chartered bank', 'Central bank of india', 'Cosmos bank', 'Yes bank', 'Le Cinema', ""St. Andrew's Auditorium"", 'Rang Sharda', 'Elco Restaurant', 'Barbeque Nation', 'Temptations', 'Balaji Restaurant', 'TIBBS Frankies', 'Yamuna Excellency', 'Bombay Biryani', ""Jimme's Kitchen"", 'Goodluck Wines', 'Ice and Spice', 'Canara Bar and Restaurant', 'Imbiss Meating Joint', 'Deepa Bar and Restaurant', 'Coffee by Di Bella', 'Tavaa Restaurant', 'Mamagoto', 'Jamjar Diner', ""Ray's Cafe & Pizzeria"", 'Howra Burger', 'Moti Mahal', ""McDonald's"", 'Beer Garden', ""St. Peter's Kindergarten"", 'St.Andrews College Gate']",[],"['Security / Fire Alarm', 'Feng Shui / Vaastu Compliant', 'Private Garden / Terrace', 'Intercom Facility', 'Lift(s)', 'High Ceiling Height', 'Maintenance Staff', 'Water Storage', 'Separate entry for servant room', 'No open drainage around', 'Bank Attached Property', 'Piped-gas', 'Internet/wi-fi connectivity', 'Recently Renovated', 'Visitor Parking', 'Swimming Pool', 'Park', 'Security Personnel', 'Natural Light', 'Airy Rooms', 'Spacious Interiors', 'Low Density Society', 'Waste Disposal', 'Rain Water Harvesting', 'Water softening plant', 'Shopping Centre', 'Fitness Centre / GYM', 'Club house / Community Center']",4.4,"{'Lifestyle': 4.5, 'Connectivity': 4.5, 'Environment': 4.1, 'Safety': 4.3}",Under Construction,
Piramal Mahalaxmi,"3 BHK House for sale in Mahalaxmi, Mumbai",https://www.99acres.com/3-bhk-bedroom-apartment-flat-for-sale-in-piramal-mahalaxmi-mahalaxmi-south-mumbai-1404-sq-ft-r1-spid-M78988539,₹7.02 Cr,"₹50,000 /sqft","1,404 sqft",Super Built-up Area,3 BHK,3  Baths,"We have many units available here. Situated in mahalaxmi, mumbai south, piramal mahalaxmi is a well planned society that offers a pleasant living experience to its residents. This 3 bhk flat in mumbai south is your opportunity to be a part of this community. The floor plan additionally contains 3 bedroom(s), 3 bathrooms and 1 balcony. All in all, the flat is spread over a super built up area of...",,,,,,,,,,,,,,,,,[],[],[],,{},Ready To Move,
Amar Villa Heritage,"3 BHK House for sale in Chembur, Mumbai",https://www.99acres.com/3-bhk-bedroom-apartment-flat-for-sale-in-amar-villa-heritage-chembur-central-mumbai-800-sq-ft-r5-spid-E73263501,₹3.25 Cr,"₹40,625 /sqft",800 sqft,Carpet Area,3 BHK,2  Baths,"Available excellent 2.5bhk for sale at diamond garden, close to ahubilla math. This beautiful apartment is a corner property which receives ample sunlight and ventilation. It is located in a quite and peaceful area and enjoys great connectivity to best restaurants, supermarkets, banks, salons etc. The building has a grand entrance lobby is well maintained society. Call us for inspection of this...",,,800.0,3 Bedrooms,2 Bathrooms,No Balcony,,3.25 Crore,6th   of 13 Floors,North,Others,1 to 5 Year Old,"Amar Villa Heritage Chembur, Mumbai",Amar Villa Heritage,Unfurnished,E73263501,"['Sharadambal Temple', 'Mar Gregorios Orthodox Syrian Church', 'masjid', 'Siddhi Vinayak Temple', 'Lobo Eye Clinic', 'Diamond Polyclinic', 'Laxmi Maternity and Nursing Home Mumbai', 'JOY Hospital', 'Sunny Childrens Hospital', 'Zen Multi Speciality Hospital', 'Oma Hospital', 'Shree Chembur Jain Medical Relief Centre', 'Rushabh Eye Hospital and Laser Centre', 'Dr.Sanjay Sonar Laparoscopy and Scopy Center', 'Dr. Das Hospital - Chembur Mumbai', 'Tandon Hospital', 'Mata Ramabai B Ambedkar Hospital', 'Matoshri Ramabai Ambedkar Maternity Hospital', 'Aayush Eye Clinic & Aayush Lasik Centre', 'Kolekar Hospital & ICCU', 'Shree Hospital', 'Hegde Hospital', 'Sai Kripa Childrens Hospital', 'Kamran Nursing Home', 'Dr Smita Mukherjees Eye Clinic', 'Yash Eye Care and Polyclinic', 'Disha Polyclinic and Nursing Home', ""Patankar's Hand and Limb Reconstruction Clinic"", 'Varsha Gandre Parekh Maternity and Surgical Hospital', 'Niramaya General Hospital', 'Balaji Medicals', 'Idfc first bank', 'Dena bank', 'State bank of india specialised nri branch', 'Hdfc bank', 'Ing bank', 'Icici bank', 'Vijya bank', 'Tea Ville Cafe', 'The J', 'Tossin Pizza', 'Barista', 'Geeta Bhawan', 'Dominoz Pizza', 'Via Bombay', 'Sevadaan Special School', 'National Job Development Center', 'Marathi Muncipal School', 'Vnp & rc marg junction railway station', 'Chembur railway station']",[],"['Security / Fire Alarm', 'Feng Shui / Vaastu Compliant', 'Intercom Facility', 'Lift(s)', 'Maintenance Staff', 'Water Storage', 'No open drainage around', 'Piped-gas', 'Security Personnel', 'Natural Light', 'Airy Rooms', 'Spacious Interiors', 'Low Density Society']",4.2,"{'Lifestyle': 4.3, 'Connectivity': 4.3, 'Environment': 4.0, 'Safety': 4.2}",Ready To Move,
Rajaram Sukur Sapphire,"1 BHK House for sale in Anand Nagar, Thane",https://www.99acres.com/1-bhk-bedroom-apartment-flat-for-sale-in-rajaram-sukur-sapphire-anand-nagar-mumbai-thane-640-sq-ft-spid-U79335763,₹60 Lac,"₹13,953 /sqft",640 sqft,Super Built-up Area,1 BHK,2  Baths,"This lovely 1 bhk apartment/flat in anand nagar is available for sale in one of thane's most popular projects, rajaram sukur sapphire. This residential flat is east-Facing direction. The floor plan additionally contains 1 bedroom(s), 2 bathrooms and 3 balconies. All in all, the flat is spread over a super built up area of 640 sq.Ft. The flat has a total of 20 floors and this property is situate...",,,,,,,,,,,,,,,,,[],[],[],,{},Ready To Move,
Kalpataru Radiance,"3 BHK House for sale in Goregaon West, Mumbai",https://www.99acres.com/3-bhk-bedroom-apartment-flat-for-sale-in-kalpataru-radiance-goregaon-west-mumbai-andheri-dahisar-1033-sq-ft-spid-X81343853,₹3.65 Cr,"₹35,375 /sqft","1,033 sqft",Carpet Area,3 BHK,3  Baths,"Check out this 3 bhk apartment for sale in kalpataru radiance, a popular residential project that houses in-Demand flats in goregaon west, western mumbai. This residential flat is west-Facing direction. The flat occupies a carpet area of 1033 sq.Ft. That consists of 3 bedrooms, 3 bathrooms . The residential building has 33 floors in total and the flat for sale is located on the 10th floor. This...",,,,,,,,,,,,,,,,,[],[],[],,{},Ready To Move,
"Karjat, Thane, Thane Outskirts","4 Bedroom House for sale in Karjat, Thane",https://www.99acres.com/4-bhk-bedroom-independent-house-villa-for-sale-in-karjat-mumbai-beyond-thane-5450-sq-ft-r8-spid-F71721386,₹2.3 Cr,"₹4,220 /sqft","5,450 sqft",Plot Area,4 BHK,5  Baths,"Mountain view 4bhk bungalow on 5450 sqft na plot for sale in karjat. Good rental income 4bhk bungalow Plot area : 5450sqft Status : Na (Non agriculture) Ownership : Resale Zone : Residential Fsi : 1:1 Electricity : Available Water : Available Priavate swimming pool Fencing : Wall compound with gate. Rate : 2.30 cr negotiable Landmark : Beyond radisson blu resort karjat, near kondhana caves Suit...",,,,,,,,,,,,,,,,,[],[],[],,{},Ready To Move,
17CH712,"2 BHK House for sale in Khar West, Mumbai",https://www.99acres.com/2-bhk-bedroom-apartment-flat-for-sale-in-khar-west-western-mumbai-750-sq-ft-spid-U81072473,₹4.95 Cr,"₹66,000 /sqft",750 sqft,Carpet Area,2 BHK,2  Baths,"This beautiful 2 bhk flat in khar west, western mumbai is situated in 17ch712, one of the popular residential society in western mumbai. The flat is west-Facing. Constructed on a carpet area of 750 sq.Ft., the flat comprises 2 bedroom(s), 2 bathrooms . The flat has a total of 12 floors and this property is situated on 4th floor. An added advantage of this 5-10 years old flat is that it is avail...",,,,,,,,,,,,,,,,,[],[],[],,{},Ready To Move,
Roswalt Zaiden,"3 BHK House for sale in Jogeshwari West, Mumbai",https://www.99acres.com/3-bhk-bedroom-apartment-flat-for-sale-in-roswalt-zaiden-jogeshwari-west-mumbai-andheri-dahisar-809-sq-ft-to-856-sq-ft-npspid-F81618689,₹2.3  - 2.44 Cr,"₹28,479 /sqft",809-856 sqft,Carpet Area,3 BHK,,"Make Roswalt Zaiden your next home. This project offers 3 BHK flats in Jogeshwari West, Western Mumbai. With a carpet area ranging from 809.0 sq. ft. to 856.0 sq. ft., these flats combine the finest design and amenities in Western Mumbai to provide a living experience unlike any other. It is an under construction project and is unique in its perfect harmony of classic form and modern constructi...",,,,,,,,,,,,,,,,F81618689,"['Goregaon Railway Station', 'Goregaon west Metro Station', 'Infiniti Mall', 'Western Express HighWay', 'H K Institute of Management', 'Madni High School', 'Kokilaben Dhirubhai Ambani Hospital', 'Chhatrapati Shivaji Airport', 'Spartan Co-Working Space', 'The Westin\xa0Hotel']",[],[],4.2,"{'Lifestyle': 4.2, 'Connectivity': 4.4, 'Environment': 3.9, 'Safety': 4.1}",Under Construction,
Shree Samarth Paradise,"1 BHK House for sale in Neral, Thane",https://www.99acres.com/1-bhk-bedroom-apartment-flat-for-sale-in-shree-samarth-paradise-neral-mumbai-beyond-thane-515-sq-ft-r1-spid-Z79160687,₹20.16 Lac,"₹3,914 /sqft",515 sqft,Built-up Area,1 BHK,1  Bath,"Shree samarth paradise Maha rera registration no:- Pphone_number Site address:- Shree samarth paradise, plot no 1,2&3, survey no. 376, opp. Ganga nagar, near nirman nagari, neral-Kalamb-Murbad road, neral east. Office address:- Manas enterprises, shop no. 18, aditi nirman co-Housing society, a wing, nirman nagari, neral east near, neral railway station, tehsil-Karjat, dist-Raigad. Project by :-...",,515.0,350.0,1 Bedroom,1 Bathroom,2 Balconies,,20.16 Lac,7th   of 7 Floors,East,"Main Road,Club,Park/Garden,Others",0 to 1 Year Old,"Shree Samarth Paradise Neral, Thane",Shree Samarth Paradise,Semifurnished,Z79160687,"['Neral train station', 'MH SH 79', 'Sharwil CBSE English School', 'DIKLAP College Of Engineering', 'Dhanvantari Hospital', 'CSM International Airport', 'Westend Hotel Matheran', 'Birdole Cricket Stadium']","['4 Light', '1 Modular Kitchen']","['Security / Fire Alarm', 'Feng Shui / Vaastu Compliant', 'Private Garden / Terrace', 'Lift(s)', 'Maintenance Staff', 'False Ceiling Lighting', 'Water Storage', 'No open drainage around', 'Recently Renovated', 'Bank Attached Property', 'Visitor Parking', 'Park', 'Security Personnel', 'Natural Light', 'Airy Rooms', 'Spacious Interiors', 'Low Density Society', 'Shopping Centre', 'Waste Disposal', 'Club house / Community Center', 'Water softening plant']",3.9,"{'Lifestyle': 3.9, 'Connectivity': 3.7, 'Environment': 4.4, 'Safety': 4.1}",Ready To Move,
Empire Dashmesh Pearl,"1 BHK House for sale in Joveli Gaon, Badlapur East",https://www.99acres.com/1-bhk-bedroom-apartment-flat-for-sale-in-empire-dashmesh-pearl-joveli-gaon-mumbai-beyond-thane-357-sq-ft-npspid-I81524123,₹21.88 Lac,"₹6,128 /sqft",357 sqft,Carpet Area,1 BHK,,"Make Empire Dashmesh Pearl your next home. Book your 1 BHK flat in Joveli Gaon, Thane Outskirts. With a carpet area of 357.0 sq. ft., the flat combines the finest design and amenities in Thane Outskirts to provide a living experience unlike any other. Here is an exclusive deal for you. Buy your 1 BHK flat for Rs. 21.88 Lac. It is a new launch property which is unique in its perfect harmony of c...",,,,,,,,,,,,,,,,I81524123,"['Gavdevi Temple', 'Jamma Masjid', 'Ram Maruti Mandir', 'Rameshwadi Church', 'Ganapti Mandir', 'Ambamata Mandir', 'Ganesh Mandir', 'Mahakali Mandir', 'Swami Samarth Math', 'Mahalaxmi Mandir', 'Saibaba Mandir', 'Axis bank ATM', 'Hdfc bank ATM', 'Sbi ATM', 'Bank of baroda ATM', 'Doddu Sheena Shetty Memorial Central Hospital', 'Chhatrapati Shivaji Maharaj Hospital', 'Vishnavi Multispeciality Hospital', 'Aastha Health Care Centre Hospital', 'Kimaya Hospital - Maternity and Surgical', 'Dhanlaxmi Hospital', ""Swanand Children's Hospitals"", 'Bhagwati Healthcare Pvt Ltd', 'Dristhi Eye Hospital', 'Dhanvantari Hospitals Pvt.Ltd.', 'Urmi Eye Clinic and Phaco Centre', 'Sfurti Multispeciality Hospital', 'Government Hospital', 'Rathod Hospital and Ccu', 'Dube Hospital', 'Matrix Hospital', 'Maxcare Multispeciality Hospital', ""Sparsh Children's Hospital"", 'Vatsalya Maternity and Surgical Hospital', 'Mamata Hospital.', 'Guardian Pharmacy', 'Apollo Pharmacy', 'State bank of india', 'Dns bank', 'Canera bank', 'Bank of maharashtra', 'Hdfc bank', 'Vaishali Talkies', 'Hotel Atithi', 'Matoshree Hotel', 'Hotel Ambika', 'Navaratna', 'Poddar Brio International School', 'Badlapur railway station', 'Grantha sakha. library']",[],[],,{},Under Construction,
dadabhai road,"3 BHK House for sale in Vile Parle West, Mumbai",https://www.99acres.com/3-bhk-bedroom-apartment-flat-for-sale-in-vile-parle-west-western-mumbai-2063-sq-ft-spid-L81492235,₹5.75 Cr,"₹27,872 /sqft","2,063 sqft",Super Built-up Area,3 BHK,3  Baths,"Check out this 3 bhk apartment for sale in dadabhai road, a popular residential project that houses in-Demand flats in vile parle west, western mumbai. This is a east-Facing property. Constructed on a super built up area of 2063 sq.Ft., the flat comprises 3 bedroom(s), 3 bathrooms . The flat has a total of 10 floors and this property is situated on 6th floor. This is a ready to move project and...",,,,,,,,,,,,,,,,,[],[],[],,{},Ready To Move,
New Chs,"3 BHK House for sale in Matunga East, Mumbai",https://www.99acres.com/3-bhk-bedroom-apartment-flat-for-sale-in-matunga-east-mumbai-south-1160-sq-ft-r1-spid-L79408739,₹6.5 Cr,"₹56,034 /sqft","1,160 sqft",Carpet Area,3 BHK,3  Baths,"This 3 bhk flat is located in new chs, which houses some of the most spacious flats in matunga east, mumbai south. The flat is north-East-Facing. The floor plan additionally contains 3 bedroom(s), 3 bathrooms . All in all, the flat is spread over a carpet area of 1160 sq.Ft. This flat lies on the 14th level of a 22 storey building. This is a ready to move project and the property is 1-5 years o...",,,,,,,,,,,,,,,,,[],[],[],,{},Ready To Move,
Lodha Casa Rio Dombivli East,"2 BHK House for sale in Dombivli East, Thane",https://www.99acres.com/2-bhk-bedroom-apartment-flat-for-sale-in-lodha-casa-rio-dombivli-east-dombivli-east-mumbai-beyond-thane-1044-sq-ft-r3-spid-O70359652,₹50 Lac,"₹7,288 /sqft","1,044 sqft",Super Built-up Area,2 BHK,2  Baths,"Lodha casa rio dombivli east river retreat is one of mumbai beyond thane's most sought after destination for apartments and this 2 bhk flat in dombivli east is your opportunity to be a part of this community. This property faces the east direction. The flat occupies a super built up area of 1044 sq.Ft. That consists of 2 bedrooms, 2 bathrooms and 1 balcony. The residential building has 18 floor...",,,,,,,,,,,,,,,,,[],[],[],,{},Ready To Move,
On Request,"2 BHK House for sale in Vikhroli East, Mumbai",https://www.99acres.com/2-bhk-bedroom-apartment-flat-for-sale-in-vikhroli-east-central-mumbai-suburbs-500-sq-ft-spid-K81387801,₹95 Lac,"₹19,000 /sqft",500 sqft,Built-up Area,2 BHK,2  Baths,"Looking for a 2 bhk property for sale in central mumbai? Buy this 2 bhk flat in on request that is situated in vikhroli east, central mumbai. The floor plan additionally contains 2 bedrooms, 2 bathrooms . All in all, the flat is spread over a built up area of 500 sq.Ft. This flat is situated on the 10th floor of this 22 floors tall residential building. This residential flat is currently under ...",,,,,,,,,,,,,,,,,[],[],[],,{},Under Construction,
Tirumala Estate,"2 BHK House for sale in Kalher, Thane West",https://www.99acres.com/2-bhk-bedroom-apartment-flat-for-sale-in-tirumala-estate-kalher-mumbai-thane-720-sq-ft-r4-spid-N64948462,₹28.8 Lac,"₹4,000 /sqft",720 sqft,Built-up Area,2 BHK,2  Baths,"This 2 bhk flat is located in tirumala estate, which houses some of the most spacious flats in kalher, mumbai thane. The floor plan additionally contains 2 bathrooms and 1 balcony. All in all, the flat is spread over anbuilt up area of 720 sq.Ft.. The flat building has a total of 3 floors and this property is situated on 1st floor. This is a ready to move project and the property is 0-1 year(s)...",,,,,,,,,,,,,,,,,[],[],[],,{},Ready To Move,
Tirumala Estate Phase 2,"2 BHK House for sale in Kasheli, Thane",https://www.99acres.com/2-bhk-bedroom-apartment-flat-for-sale-in-tirumala-estate-phase-2-kasheli-thane-805-sq-ft-spid-K80361831,₹33.81 Lac,"₹4,200 /sqft",805 sqft,Carpet Area,2 BHK,2  Baths,"This beautiful 2 bhk flat in kasheli, thane is situated in tirumala estate phase 2, one of the popular residential society in thane. This is a east-Facing property. The flat occupies a carpet area of 805 sq.Ft. That consists of 2 bedrooms, 2 bathrooms and 1 balcony. This flat is situated on the 2nd floor of this 3 floors tall residential building. As the project is already ready to move, so you...",,,805.0,2 Bedrooms,2 Bathrooms,1 Balcony,,33.81 Lac,2nd   of 3 Floors,South-East,,1 to 5 Year Old,"Tirumala Estate Phase 2 Kasheli, Thane",Tirumala Estate Phase 2,Unfurnished,K80361831,"['Kalva', 'Korum Mall', 'NH 848', 'Evershine', 'MU Thane Campus', 'S.S. Hospital', 'CSM Intl Airport', 'JSR Complex', 'Tikuji ni Wadi', 'Dadoji Kondadev']",[],"['Security / Fire Alarm', 'Feng Shui / Vaastu Compliant', 'Private Garden / Terrace', 'Intercom Facility', 'Lift(s)', 'Maintenance Staff', 'False Ceiling Lighting', 'Water Storage', 'No open drainage around', 'Visitor Parking', 'Park', 'Natural Light', 'Internet/wi-fi connectivity', 'Airy Rooms', 'Spacious Interiors', 'Fitness Centre / GYM', 'Waste Disposal']",3.8,"{'Lifestyle': 3.6, 'Connectivity': 3.9, 'Environment': 3.7, 'Safety': 3.9}",Ready To Move,
Lotus CHS,"2 BHK House for sale in Airoli sector 20 C, Navi Mumbai",https://www.99acres.com/2-bhk-bedroom-apartment-flat-for-sale-in-lotus-chs-airoli-sector-20-c-navi-mumbai-959-sq-ft-spid-F81545441,₹1.2 Cr,"₹12,513 /sqft",959 sqft,Super Built-up Area,2 BHK,2  Baths,"This lovely 2 bhk apartment/flat in airoli sector 20 c is available for sale in one of navi mumbai's most popular projects, lotus chs. This property faces the west direction. The flat occupies a super built up area of 959 sq.Ft. That consists of 2 bedrooms, 2 bathrooms and 1 balcony. This flat is situated on the 1st floor of this 7 floors tall residential building. This 5-10 years old property ...",,,,,,,,,,,,,,,,,[],[],[],,{},Ready To Move,
Park View,"2 BHK House for sale in Ghodbunder Road, Thane",https://www.99acres.com/2-bhk-bedroom-apartment-flat-for-sale-in-park-view-ghodbunder-road-mumbai-thane-650-sq-ft-spid-B79734301,₹98 Lac,"₹15,076 /sqft",650 sqft,Carpet Area,2 BHK,2  Baths,"Park view is one of the most popular destination for buying apartments/ flats in ghodbunder road, thane. You too can be a part of this society by purchasing this 2 bhk flat here. The flat is facing the north-East direction. Constructed on a carpet area of 650 sq.Ft., the flat comprises 2 bedroom(s), 2 bathrooms and 2 balconies. This flat is situated on the 4th floor of this 16 floors tall resid...",,,650.0,2 Bedrooms,2 Bathrooms,2 Balconies,,98 Lac,4th   of 16 Floors,North-East,"Pool,Park/Garden,Club,Main Road",5 to 10 Year Old,"Park View Ghodbunder Road, Thane",Park View,Semifurnished,B79734301,"['Thane Station', 'Korum Mall', 'Eastern Express Hwy', 'EuroSchool Thane', 'University of Mumbai', 'Vedant Multispeciality Hospital', 'CSM Int. Airport', 'Tata Consultancy Services', 'Planet Hollywood Thane City', 'Suraj Water Park', 'Dadoji Konddev Stadium', 'Retibunder Beach']","['2 Wardrobe', '3 Fan', '1 Exhaust Fan', '5 Light', '1 Modular Kitchen']","['Security / Fire Alarm', 'Power Back-up', 'Feng Shui / Vaastu Compliant', 'Intercom Facility', 'Lift(s)', 'Water purifier', 'High Ceiling Height', 'Maintenance Staff', 'False Ceiling Lighting', 'Water Storage', 'No open drainage around', 'Bank Attached Property', 'Piped-gas', 'Visitor Parking', 'Swimming Pool', 'Park', 'Natural Light', 'Airy Rooms', 'Spacious Interiors', 'Fitness Centre / GYM', 'Waste Disposal', 'Club house / Community Center']",4.1,"{'Connectivity': 4.0, 'Green Area': 4.1, 'Amenities': 4.1, 'Management': 4.0, 'Construction': 4.0}",Ready To Move,
Galaxy Orion,"2 BHK House for sale in Sector 35I Kharghar, Navi Mumbai",https://www.99acres.com/2-bhk-bedroom-apartment-flat-for-sale-in-sector-35i-kharghar-navi-mumbai-1120-sq-ft-r4-spid-Q70995066,₹95 Lac,"₹8,482 /sqft","1,120 sqft",Built-up Area,2 BHK,2  Baths,"Galaxy orion is one of navi mumbai's most sought after destination for apartments and this 2 bhk flat in sector 35i kharghar is your opportunity to be a part of this community. This property faces the east direction. Containing 2 bedroom(s), 2 bathrooms and 2 balconies, this flat is spread over a built up area of 1120 sq.Ft. This flat is situated on the 12th floor of this 21 floors tall residen...",,,,,,,,,,,,,,,,,[],[],[],,{},Ready To Move,
