name,name_location,link,price,price_per_sqft,area,area_type,bedroom,bathroom,description,super_builtup,built_up,carpet_area,config_bedroom,config_bathroom,balcony,additional_rooms,price_text,floor,facing,overlooking,age,address,society,furnish_type,property_id,nearby_locations,furnish_details,features,rating,rating_list,status,Unnamed: 0
Amar Villa Heritage,"3 BHK House for sale in Chembur, Mumbai",https://www.99acres.com/3-bhk-bedroom-apartment-flat-for-sale-in-amar-villa-heritage-chembur-central-mumbai-800-sq-ft-r5-spid-E73263501,₹3.25 Cr,"₹40,625 /sqft",800 sqft,Carpet Area,3 BHK,2  Baths,"Available excellent 2.5bhk for sale at diamond garden, close to ahubilla math. This beautiful apartment is a corner property which receives ample sunlight and ventilation. It is located in a quite and peaceful area and enjoys great connectivity to best restaurants, supermarkets, banks, salons etc. The building has a grand entrance lobby is well maintained society. Call us for inspection of this...",,,800.0,3 Bedrooms,2 Bathrooms,No Balcony,,3.25 Crore,6th   of 13 Floors,North,Others,1 to 5 Year Old,"Amar Villa Heritage Chembur, Mumbai",Amar Villa Heritage,Unfurnished,E73263501,"['Sharadambal Temple', 'Mar Gregorios Orthodox Syrian Church', 'masjid', 'Siddhi Vinayak Temple', 'Lobo Eye Clinic', 'Diamond Polyclinic', 'Laxmi Maternity and Nursing Home Mumbai', 'JOY Hospital', 'Sunny Childrens Hospital', 'Zen Multi Speciality Hospital', 'Oma Hospital', 'Shree Chembur Jain Medical Relief Centre', 'Rushabh Eye Hospital and Laser Centre', 'Dr.Sanjay Sonar Laparoscopy and Scopy Center', 'Dr. Das Hospital - Chembur Mumbai', 'Tandon Hospital', 'Mata Ramabai B Ambedkar Hospital', 'Matoshri Ramabai Ambedkar Maternity Hospital', 'Aayush Eye Clinic & Aayush Lasik Centre', 'Kolekar Hospital & ICCU', 'Shree Hospital', 'Hegde Hospital', 'Sai Kripa Childrens Hospital', 'Kamran Nursing Home', 'Dr Smita Mukherjees Eye Clinic', 'Yash Eye Care and Polyclinic', 'Disha Polyclinic and Nursing Home', ""Patankar's Hand and Limb Reconstruction Clinic"", 'Varsha Gandre Parekh Maternity and Surgical Hospital', 'Niramaya General Hospital', 'Balaji Medicals', 'Idfc first bank', 'Dena bank', 'State bank of india specialised nri branch', 'Hdfc bank', 'Ing bank', 'Icici bank', 'Vijya bank', 'Tea Ville Cafe', 'The J', 'Tossin Pizza', 'Barista', 'Geeta Bhawan', 'Dominoz Pizza', 'Via Bombay', 'Sevadaan Special School', 'National Job Development Center', 'Marathi Muncipal School', 'Vnp & rc marg junction railway station', 'Chembur railway station']",[],"['Security / Fire Alarm', 'Feng Shui / Vaastu Compliant', 'Intercom Facility', 'Lift(s)', 'Maintenance Staff', 'Water Storage', 'No open drainage around', 'Piped-gas', 'Security Personnel', 'Natural Light', 'Airy Rooms', 'Spacious Interiors', 'Low Density Society']",4.2,"{'Environment': 4.0, 'Lifestyle': 4.3, 'Connectivity': 4.3, 'Safety': 4.2}",Ready To Move,
Tirumala Estate,"2 BHK House for sale in Kalher, Thane West",https://www.99acres.com/2-bhk-bedroom-apartment-flat-for-sale-in-tirumala-estate-kalher-mumbai-thane-720-sq-ft-r4-spid-N64948462,₹28.8 Lac,"₹4,000 /sqft",720 sqft,Built-up Area,2 BHK,2  Baths,"This 2 bhk flat is located in tirumala estate, which houses some of the most spacious flats in kalher, mumbai thane. The floor plan additionally contains 2 bathrooms and 1 balcony. All in all, the flat is spread over anbuilt up area of 720 sq.Ft.. The flat building has a total of 3 floors and this property is situated on 1st floor. This is a ready to move project and the property is 0-1 year(s)...",,720.0,504.0,2 Bedrooms,2 Bathrooms,1 Balcony,,28.8 Lac,1st   of 3 Floors,North-West,,0 to 1 Year Old,"Tirumala Estate Kalher, Thane West",Tirumala Estate,Unfurnished,N64948462,"['LEO Internaonal School', 'Lile Angel School', 'L.B. Joshi Foundation School', 'Divine English High School', 'Holy Mary School', 'S.S. Hospital & Research Center', 'Asha Mul-Speciality Hospital', 'ICICI Bank', 'Union Bank of India', 'Central Bank', 'Kotak Mahindra', 'GP Parsik Bank']",[],"['Lift(s)', 'Park', 'Internet/wi-fi connectivity', 'Fitness Centre / GYM', 'Club house / Community Center']",3.3,"{'Management': 3.3, 'Amenities': 3.3, 'Green Area': 3.2, 'Construction': 3.2, 'Connectivity': 3.3}",Ready To Move,
Hiranandani Lightbridge,"3 BHK House for sale in Hiranandani Meadows, Manpada",https://www.99acres.com/3-bhk-bedroom-apartment-flat-for-sale-in-hiranandani-lightbridge-hiranandani-meadows-mumbai-thane-2150-sq-ft-r17-spid-C63024150,₹4.15 Cr,"₹19,302 /sqft","2,150 sqft",Super Built-up Area,3 BHK,3  Baths,"Explore your dream home 3 bhk flat for sale in hiranandani lightbridge, thane We are delighted to present an excellent opportunity to purchase a beautiful 3 bhk flat in the prestigious hiranandani lightbridge located in the serene hiranandani meadows, thane. Key features: 3 bedrooms spacious, well-Ventilated, and designed for comfort. West-Facing enjoy beautiful sunsets and natural light throug...",,,,,,,,,,,,,,,,,[],[],[],,{},Ready To Move,
Hiranandani Athena and Barca,"2 BHK House for sale in Hiranandani Estate, Thane",https://www.99acres.com/2-bhk-bedroom-apartment-flat-for-sale-in-hiranandani-athena-and-barca-hiranandani-estate-mumbai-thane-1004-sq-ft-spid-X81160113,₹1.85 Cr,"₹18,426 /sqft","1,004 sqft",Built-up Area,2 BHK,2  Baths,"Located in the popular residential address of hiranandani estate, thane, hiranandani athena and barca is one of the most preferred destination for apartments in thane. This 2 bhk flat is your ticket to be a part of this community. This is a north-Facing property. The flat is over 1004 sq.Ft. Built up area and comes with 2 bedroom(s), 2 bathrooms and 2 balconies. The flat has a total of 13 floor...",,1004.0,704.0,2 Bedrooms,2 Bathrooms,2 Balconies,,1.85 Crore,11st   of 13 Floors,North,"Park/Garden,Club,Main Road",1 to 5 Year Old,"Hiranandani Athena and Barca Hiranandani Estate, Thane",Hiranandani Athena and Barca,Semifurnished,X81160113,"['Thane Railway Station', 'Arcadia Mall', 'National Highway', 'Podar International School', 'Sikkim Manipal University', 'Horizon Prime Hospital', 'Butterfly Garden', 'Dadoji Kondadev Stadium']","['2 Fan', '1 Exhaust Fan', '4 Light', '1 AC', '1 Modular Kitchen']","['Lift(s)', 'Maintenance Staff', 'Park', 'Piped-gas', 'Rain Water Harvesting']",4.5,"{'Environment': 4.5, 'Lifestyle': 4.6, 'Connectivity': 4.5, 'Safety': 4.6}",Ready To Move,
Shree Samarth Paradise,"1 BHK House for sale in Neral, Thane",https://www.99acres.com/1-bhk-bedroom-apartment-flat-for-sale-in-shree-samarth-paradise-neral-mumbai-beyond-thane-515-sq-ft-r1-spid-Z79160687,₹20.16 Lac,"₹3,914 /sqft",515 sqft,Built-up Area,1 BHK,1  Bath,"Shree samarth paradise Maha rera registration no:- Pphone_number Site address:- Shree samarth paradise, plot no 1,2&3, survey no. 376, opp. Ganga nagar, near nirman nagari, neral-Kalamb-Murbad road, neral east. Office address:- Manas enterprises, shop no. 18, aditi nirman co-Housing society, a wing, nirman nagari, neral east near, neral railway station, tehsil-Karjat, dist-Raigad. Project by :-...",,515.0,350.0,1 Bedroom,1 Bathroom,2 Balconies,,20.16 Lac,7th   of 7 Floors,East,"Main Road,Club,Park/Garden,Others",0 to 1 Year Old,"Shree Samarth Paradise Neral, Thane",Shree Samarth Paradise,Semifurnished,Z79160687,"['Neral train station', 'MH SH 79', 'Sharwil CBSE English School', 'DIKLAP College Of Engineering', 'Dhanvantari Hospital', 'CSM International Airport', 'Westend Hotel Matheran', 'Birdole Cricket Stadium']","['4 Light', '1 Modular Kitchen']","['Security / Fire Alarm', 'Feng Shui / Vaastu Compliant', 'Private Garden / Terrace', 'Lift(s)', 'Maintenance Staff', 'False Ceiling Lighting', 'Water Storage', 'No open drainage around', 'Recently Renovated', 'Bank Attached Property', 'Visitor Parking', 'Park', 'Security Personnel', 'Natural Light', 'Airy Rooms', 'Spacious Interiors', 'Low Density Society', 'Shopping Centre', 'Waste Disposal', 'Club house / Community Center', 'Water softening plant']",3.9,"{'Environment': 4.4, 'Lifestyle': 3.9, 'Connectivity': 3.7, 'Safety': 4.1}",Ready To Move,
Jade park,"3 BHK House for sale in Juhu, Mumbai",https://www.99acres.com/3-bhk-bedroom-apartment-flat-for-sale-in-juhu-western-mumbai-1200-sq-ft-spid-E81686858,₹6 Cr,"₹50,000 /sqft","1,200 sqft",Carpet Area,3 BHK,3  Baths,"Jade park epitomizes the essence of luxury living, perfectly reflected in a vibrant and close-Knit community. Nestled in the heart of vile parle west, this unique gem sets a new standard for residential excellence. It harmoniously blends elegant living spaces with an array of luxurious lifestyle amenities, offering a life of sophistication and comfort. Spanning 3 acres of low-Density redevelopm...",,,,,,,,,,,,,,,,,[],[],[],,{},Under Construction,
Lodha Splendora,"2 BHK House for sale in Ghodbunder Road, Thane",https://www.99acres.com/2-bhk-bedroom-apartment-flat-for-sale-in-lodha-splendora-ghodbunder-road-mumbai-thane-1250-sq-ft-r20-spid-J39987971,₹84 Lac,"₹8,096 /sqft","1,250 sqft",Super Built-up Area,2 BHK,2  Baths,"This is a property where you can feel the nature and pollution free environment while enjoying your homes in thane city, it provides you good ambience surrounded with nature and peace. It comes with all basic amenities like garden, play court, children play area & many more, flat is very well maintained which includes modular kitchen, wardrobes, & etc. It comes with all luxurios amenities like ...",1250.0,1150.0,707.0,2 Bedrooms,2 Bathrooms,1 Balcony,Store Room,84 Lac,18th   of 31 Floors,East,"Main Road,Park/Garden",1 to 5 Year Old,"Lodha Splendora Ghodbunder Road, Thane",Lodha Splendora,Semifurnished,J39987971,"['Thane Railway Station', 'Kapurbawdi Metro Station', 'Big Centre Thane', 'NH 48', 'DG International School', 'Aarav Muchhala Junior College', 'Brahmand Multispeciality Hospital', 'CSM International Airport', 'Thaneone Corporate Business IT Park', 'Suraj Water Park', 'Golden Swan Country Club', 'Dadoji Kondadev Stadium', 'Seashore New Point']","['5 Fan', '5 Light']","['Security / Fire Alarm', 'Feng Shui / Vaastu Compliant', 'Private Garden / Terrace', 'Intercom Facility', 'Lift(s)', 'Water purifier', 'Maintenance Staff', 'Water Storage', 'Bank Attached Property', 'Piped-gas', 'Visitor Parking', 'Swimming Pool', 'Park', 'Security Personnel', 'Shopping Centre', 'Fitness Centre / GYM', 'Waste Disposal', 'Rain Water Harvesting', 'Water softening plant']",4.2,"{'Management': 3.9, 'Amenities': 4.4, 'Green Area': 4.5, 'Construction': 3.9, 'Connectivity': 4.1}",Ready To Move,
Wadhwa Pristine,"2 BHK House for sale in Mahalaxmi Sindhi Colony, Matunga, Mumbai",https://www.99acres.com/2-bhk-bedroom-apartment-flat-for-sale-in-wadhwa-pristine-mahalaxmi-sindhi-colony-mumbai-south-760-sq-ft-r2-spid-L77104697,₹4.5 Cr,"₹59,165 /sqft",760 sqft,Carpet Area,2 BHK,2  Baths,"This beautiful 2 bhk flat in mahalaxmi sindhi colony, mumbai south is situated in wadhwa pristine, one of the popular residential society in mumbai south. This residential flat is east-Facing direction. Containing 2 bedroom(s), 2 bathrooms, this flat is spread over a built up area of 762 sq.Ft. The residential building has 38 floors in total and the flat for sale is located on the 9th floor. Th...",,,70.66,2 Bedrooms,2 Bathrooms,No Balcony,,4.5 Crore,9th   of 38 Floors,East,Main Road,1 to 5 Year Old,"Wadhwa Pristine Mahalaxmi Sindhi Colony, Matunga, Mumbai",Wadhwa Pristine,Semifurnished,L77104697,"['Dadar W Railway station', 'Dharavi Metro Station', 'Star mall', 'Gokhale Road', 'Eastern Express Highway', 'Shardashram Vidyamandir Int. School', 'Mumbai University', 'Hinduja Hospital OPD Building', 'Chhatrapati Shivaji Maharaj Int. Airport', 'Chhatrapati Shivaji maharaj Park', 'ITC Grand Central Hotel', 'Dadar Chowpatty']","['1 Exhaust Fan', '2 Geyser', '3 AC', '1 Modular Kitchen']","['Security / Fire Alarm', 'Intercom Facility', 'Lift(s)', 'Maintenance Staff', 'Water Storage', 'Park', 'Visitor Parking', 'Fitness Centre / GYM', 'Rain Water Harvesting']",4.0,"{'Environment': 4.0, 'Lifestyle': 4.0, 'Connectivity': 4.0, 'Safety': 3.8}",Ready To Move,
shraddha evoque wing chsl,"1 BHK House for sale in Bhandup West, Mumbai",https://www.99acres.com/1-bhk-bedroom-apartment-flat-for-sale-in-bhandup-west-central-mumbai-suburbs-229-sq-ft-spid-Y81646789,₹50 Lac,"₹21,834 /sqft",229 sqft,Carpet Area,1 BHK,1  Bath,"We are the proud owners of this 1 rk east facing apartment available in shraddha evoque a wing chsl, bhandup west, central mumbai. This it is a and the unit is located on 11th floor and has a carpet area of 229 sq.Ft. . It has 1 bathroom(s). The ownership is freehold type.",,,,,,,,,,,,,,,,,[],[],[],,{},Ready To Move,
Dharma sita park,"1 BHK House for sale in Dombivli West, Thane",https://www.99acres.com/1-bhk-bedroom-apartment-flat-for-sale-in-dombivli-west-mumbai-beyond-thane-590-sq-ft-spid-F81608437,₹50 Lac,"₹10,309 /sqft",590 sqft,Built-up Area,1 BHK,1  Bath,"Specious hall bed room & kitchen
Ample fresh air
5min from dombivli & thakurli railway station , east facing lift
Nearest bridge for nashik highway &thane city",,,,,,,,,,,,,,,,,[],[],[],,{},Ready To Move,
kalash Residency karanjade,"1 BHK House for sale in Karanjade, Navi Mumbai",https://www.99acres.com/1-bhk-bedroom-apartment-flat-for-sale-in-karanjade-navi-mumbai-750-sq-ft-spid-O81764346,₹50 Lac,"₹6,666 /sqft",750 sqft,Carpet Area,1 BHK,1  Bath,This is full one bhk flat with have unique terrace for all hall kitchen and bedroom,,,,,,,,,,,,,,,,,[],[],[],,{},Ready To Move,
Regency Anantam,"1 BHK House for sale in Dombivli East, Thane",https://www.99acres.com/1-bhk-bedroom-apartment-flat-for-sale-in-regency-anantam-dombivli-east-mumbai-beyond-thane-527-sq-ft-spid-X81730448,₹49.25 Lac,"₹9,345 /sqft",527 sqft,Carpet Area,1 BHK,2  Baths,"This beautiful 1 bhk flat in dombivli east, thane outskirts is situated in regency anantam, one of the popular residential society in thane outskirts. This is a north-East-Facing property. The flat occupies a carpet area of 527 sq.Ft. That consists of 1 bedroom, 2 bathrooms and 3 balconies. This flat is situated on the 22nd floor of this 23 floors tall residential building. This 0-1 year old pr...",,,,,,,,,,,,,,,,,[],[],[],,{},Ready To Move,
DB Ozone,"1 BHK House for sale in Mira Road, Mira Bhayandar",https://www.99acres.com/1-bhk-bedroom-apartment-flat-for-sale-in-db-ozone-mira-road-mira-bhayandar-585-sq-ft-spid-C81725620,₹48 Lac,"₹8,204 /sqft",585 sqft,Super Built-up Area,1 BHK,2  Baths,"This beautiful 1 bhk flat in mira road, mira bhayandar is situated in db ozone, one of the popular residential society in mira bhayandar. The flat is east-Facing. The flat occupies a super built up area of 585 sq.Ft. That consists of 1 bedroom, 2 bathrooms and 2 balconies. The residential building has 19 floors in total and the flat for sale is located on the 5th floor. An added advantage of th...",,,,,,,,,,,,,,,,,[],[],[],,{},Ready To Move,
Sanjeevani Apartment,"1 BHK House for sale in Kalyan West, Thane",https://www.99acres.com/1-bhk-bedroom-apartment-flat-for-sale-in-sanjeevani-apartment-kalyan-west-mumbai-beyond-thane-700-sq-ft-r1-spid-J78982653,₹45 Lac,"₹8,823 /sqft",700 sqft,Super Built-up Area,1 BHK,1  Bath,"Situated in kalyan west, thane outskirts, sanjeevani apartment is a well planned society that offers a pleasant living experience to its residents. This 1 bhk flat in thane outskirts is your opportunity to be a part of this community. This residential flat is east-Facing direction. Containing 1 bedroom(s), 1 bathroom and 1 balcony, this flat is spread over a super built up area of 700 sq.Ft. Th...",,,,,,,,,,,,,,,,,[],[],[],,{},Ready To Move,
Abrol Krishna Greenland Park,"1 BHK House for sale in Kasar vadavali, Thane",https://www.99acres.com/1-bhk-bedroom-apartment-flat-for-sale-in-abrol-krishna-greenland-park-kasar-vadavali-mumbai-thane-415-sq-ft-spid-I81724396,₹48 Lac,"₹11,566 /sqft",415 sqft,Carpet Area,1 BHK,2  Baths,"This 1 bhk flat is located in krishna green land park, which houses some of the most spacious flats in kasar vadavali, thane. This property faces the east direction. The flat is over 415 sq.Ft. Carpet area and comes with 1 bedroom(s), 2 bathrooms . This flat lies on the 4th level of a 7 storey building. An added advantage of this 10+ years old flat is that it is available for immediate possessi...",,,,,,,,,,,,,,,,,[],[],[],,{},Ready To Move,
sairaj guriyapada,"1 BHK House for sale in Orlem, Malad West",https://www.99acres.com/1-bhk-bedroom-apartment-flat-for-sale-in-orlem-mumbai-andheri-dahisar-305-sq-ft-spid-F81757978,₹47 Lac,"₹15,409 /sqft",305 sqft,Carpet Area,1 BHK,1  Bath,"Speciase space outside to door,
Well painted & storage facility
Extra area as balcony which can be add on in hall & bedroom
2 minutes away from orlem church, & orlem market
5 minutes away from mith chowky metro station
10-15 minutes away from malad station
School, colleges within 1-2 minutes walkable
Infinite mall nearer to 10 minutes walking distance",,,,,,,,,,,,,,,,,[],[],[],,{},Ready To Move,
Vinay Unique Sky,"1 BHK House for sale in Virar West, Mumbai",https://www.99acres.com/1-bhk-bedroom-apartment-flat-for-sale-in-vinay-unique-sky-virar-west-mumbai-450-sq-ft-spid-N81755096,₹45 Lac,"₹10,000 /sqft",450 sqft,Carpet Area,1 BHK,2  Baths,1bhk ready to move semi furnished flat on 16th floor.,,,450.0,1 Bedroom,2 Bathrooms,No Balcony,,45 Lac,16th   of 17 Floors,,"Pool,Club",1 to 5 Year Old,"Vinay Unique Sky Virar West, Mumbai",Vinay Unique Sky,Semifurnished,N81755096,"['Virar Railway Station', 'Viva Mall', 'NH 48', ""MGM Academy's High School & Jr. College"", 'ICFAI University', 'Kalpataru Hospital', 'CSM International Airport', 'Cocoon Cowork, Virar', 'Golden Chariot Vasai Hotel', 'www.starholiday.in', 'Mamavanti Stadium Satpale Bhandar Ali', 'Navapur Beach']","['4 Light', '1 Modular Kitchen']","['Lift(s)', 'Maintenance Staff', 'Swimming Pool', 'Park', 'Security Personnel', 'Fitness Centre / GYM', 'Club house / Community Center']",4.3,"{'Environment': 4.3, 'Lifestyle': 4.2, 'Connectivity': 4.3, 'Safety': 4.3}",Ready To Move,
Ornate Kallisto,"1 BHK House for sale in Bhiwandi, Thane",https://www.99acres.com/1-bhk-bedroom-apartment-flat-for-sale-in-ornate-kallisto-bhiwandi-mumbai-beyond-thane-420-sq-ft-r2-spid-W73523841,₹45 Lac,"₹10,714 /sqft",420 sqft,Carpet Area,1 BHK,1  Bath,"This property is well connected to bhiwandi,kalyan and nashik.Easy accessibility to market,hospital,temple etc.",,,,,,,,,,,,,,,,,[],[],[],,{},Ready To Move,
Channel Upvan,"1 BHK House for sale in Sai Nagar, Panvel",https://www.99acres.com/1-bhk-bedroom-apartment-flat-for-sale-in-channel-upvan-sai-nagar-navi-mumbai-682-sq-ft-spid-L81738792,₹49 Lac,"₹7,184 /sqft",682 sqft,Built-up Area,1 BHK,1  Bath,"Pipeline mgl gas, lift, parking available in society,vtemple in the society complex, bus route no.75 from panvel railway station to near society",,,,,,,,,,,,,,,,,[],[],[],,{},Ready To Move,
Sanghvi Tower,"1 BHK House for sale in Mira Road East, Mira Bhayandar",https://www.99acres.com/1-bhk-bedroom-apartment-flat-for-sale-in-sanghvi-tower-mira-road-east-mira-bhayandar-430-sq-ft-spid-Q81736932,₹50 Lac,"₹11,627 /sqft",430 sqft,Super Built-up Area,1 BHK,1  Bath,"We are the proud owners of this 1 bhk apartment available in sanghvi tower, mira road east, mira bhayandar. This it is a and the unit is located on 1st floor and has a super built-Up area of 430 sq.Ft. . It has 1 bathroom(s). The ownership is freehold type.",,,,,,,,,,,,,,,,,[],[],[],,{},Ready To Move,
Prime Homes,"1 BHK House for sale in Karanjade, Navi Mumbai",https://www.99acres.com/1-bhk-bedroom-apartment-flat-for-sale-in-prime-homes-karanjade-navi-mumbai-650-sq-ft-spid-U81303729,₹48 Lac,"₹7,384 /sqft",650 sqft,Built-up Area,1 BHK,1  Bath,"This beautiful 1 bhk flat in karanjade, navi mumbai is situated in prime homes, one of the popular residential society in navi mumbai. The flat occupies a built up area of 650 sq.Ft. That consists of 1 bedroom, 1 bathroom and 3 balconies. This flat is situated on the 4th floor of this 7 floors tall residential building. An added advantage of this 5-10 years old flat is that it is available for ...",,650.0,,1 Bedroom,1 Bathroom,3 Balconies,,48 Lac,4th   of 7 Floors,,Park/Garden,5 to 10 Year Old,"Prime Homes Karanjade, Navi Mumbai",Prime Homes,Semifurnished,U81303729,"['K Mall', 'PANCHAMUKHI SRI HANUMAN MANDIR', 'Axis bank ATM', 'Manomay Hospital', 'Government Rural Hospital', 'Yash Hospital', 'Panvel Hospital', 'Max Life Hospital', 'Laxmi Eye Institute', 'Akshay Eye Clinic', 'Nikam Parmer Hospital', 'Patel Clinic', 'Paramount Medical Services Pvt Ltd', 'Pritam Hospital Raigarh', 'Likhite Orthopaedic & Paediatric Super Speciality Clinic& Nicu', 'Anand Mangal Maternity And Eye Clinic', 'Aashirwad Ent Clinic', 'Ameya Clinic', 'Ingle Eye Clinic', 'Rural Hospital', 'Sukam Hospital', 'Ghanate Hospital', 'Sulochan Eye Clinic', 'Neo Clinic', 'Purohit Clinic', 'Sudha Shankar Netralaya', 'Dr.Prabhakar Patwardhan Smruti Rugnalaya', 'Siddhi Clinic', ""Dr. Oza's Hospital"", 'Hande Hospital', 'Dandekar Clinic', 'Dr. Kale Hospital', 'Gune Hospital', 'Sahasrabudhe Hospital and I.C.C.U', 'Mhatre Accident Hospital', 'Life Line Hospital', 'Siddhivinayak Hospital', 'Dr Ghodkes Sanjay Clinic', 'Shri Swami Samarth Hospital', ""Dr. Nadkarni Children's Hospital"", 'Dhamke Hospital', 'Birmole Hospital', 'Prachin Healthcare', ""Dr. Patil's Hospital"", 'Bharat Petroleum', 'Barns Galaxy College of Old', 'Panvel suburban railway station', 'Panvel railway station', 'Panvel express railway station', 'Maha e seva kendra']","['2 Fan', '2 Light']","['Security / Fire Alarm', 'Lift(s)', 'Water Storage', 'Park', 'Security Personnel', 'Fitness Centre / GYM', 'Rain Water Harvesting']",4.3,"{'Environment': 4.3, 'Lifestyle': 4.2, 'Connectivity': 4.3, 'Safety': 4.3}",Ready To Move,
.,"1 BHK House for sale in Kharghar, Navi Mumbai",https://www.99acres.com/1-bhk-bedroom-apartment-flat-for-sale-in-kharghar-navi-mumbai-430-sq-ft-r3-spid-W71509116,₹45 Lac,"₹10,465 /sqft",430 sqft,Super Built-up Area,1 BHK,1  Bath,"We are the proud owners of this 1 bhk apartment available in ., kharghar, navi mumbai. This it is a and the unit is located on 6th floor and has a super built-Up area of 430 sq.Ft. . It has 1 bathroom(s). The unit is located in a co-Operative society.",,,,,,,,,,,,,,,,,[],[],[],,{},Under Construction,
Lodha Casa Bella Gold,"1 BHK House for sale in Dombivli East, Thane",https://www.99acres.com/1-bhk-bedroom-apartment-flat-for-sale-in-lodha-casa-bella-gold-dombivli-east-mumbai-beyond-thane-585-sq-ft-spid-M81730850,₹45 Lac,"₹7,692 /sqft",585 sqft,Built-up Area,1 BHK,1  Bath,"A fully furnished 1 bhk apartment is available for sale in lodha casa bella gold, one of the most prominent projects for flats in palava. The flat has 8 floors, and this property is situated on the 3rd floor.",,,,,,,,,,,,,,,,,[],[],[],,{},Ready To Move,
Bella Donna CHS,"1 BHK House for sale in Medetiya Nagar, Mira Road East",https://www.99acres.com/1-bhk-bedroom-apartment-flat-for-sale-in-bella-donna-chs-medetiya-nagar-mira-bhayandar-350-sq-ft-spid-K81722218,₹50 Lac,"₹14,285 /sqft",350 sqft,Carpet Area,1 BHK,1  Bath,"This beautiful 1 bhk flat in medetiya nagar, mira bhayandar is situated in bella donna chs, one of the popular residential society in mira bhayandar. The floor plan additionally contains 1 bedroom(s), 1 bathroom . All in all, the flat is spread over a carpet area of 350 sq.Ft. The flat has a total of 7 floors and this property is situated on top floor. This is a ready to move project and the pr...",,,350.0,1 Bedroom,1 Bathroom,No Balcony,,50 Lac,7th   of 7 Floors,,Main Road,10+ Year Old,"Bella Donna CHS Medetiya Nagar, Mira Road East",Bella Donna CHS,,K81722218,[],[],"['Lift(s)', 'Maintenance Staff', 'Park', 'Security Personnel']",,{},Ready To Move,
shankeshwar platina,"1 BHK House for sale in Chanakya Nagar, Kalyan West",https://www.99acres.com/1-bhk-bedroom-apartment-flat-for-sale-in-chanakya-nagar-mumbai-beyond-thane-550-sq-ft-spid-Q81718368,₹50 Lac,"₹9,090 /sqft",550 sqft,Carpet Area,1 BHK,1  Bath,Ready to move property apart from ac point and indian toilet has bee changed apart from this no extra work has been done. 24/7 water facility.,,,550.0,1 Bedroom,1 Bathroom,1 Balcony,,50 Lac,11st   of 14 Floors,North,"Park/Garden,Main Road",0 to 1 Year Old,"shankeshwar platina Chanakya Nagar, Kalyan West",,Unfurnished,Q81718368,"['Shree Ram Mandir', 'Kali Masjid', 'Shwaas Multispeciality Hospital', 'Tanmay Health Care', 'Aayush Hospital', 'Anand Nursing Home', 'Lotus Maternity Home and Child Surgery Center', ""Kilbil Children's Hospital"", 'Pratibha Hospital', 'The Kalyan Hospital and Iccu', 'Cauvery Uroderm Centre', 'Bhoir Hospital', 'Gurukripa Criticare Hospital Kalyan', 'Sushrut Nursing Home', 'Wellspring Clinic', 'Sai Sanjivani Criticare Hospital', 'Sai Prasad Nursing Home and Scu', 'Jagannath hospital', 'National Hospital', 'Apex Hospital', 'Katkar Hospital', 'Phadke Hospital', ""Social Service League Kalyan's Charitable Eye and General Hospital"", 'Sampada Hospital', 'Sai Shraddha Nursing Home', 'Om Hospital', ""Dr. Sundeep D. Jadhav's Nursing Home"", 'Dombivli nagari sahakari bank ltd.', 'Acharya Atre Rangmandir', ""McDonald's"", 'Regal College']",[],"['Maintenance Staff', 'Water Storage', 'Visitor Parking']",,{},Ready To Move,
Qualitas Extencia,"1 BHK House for sale in Sector 17 Ulwe, Navi Mumbai",https://www.99acres.com/1-bhk-bedroom-apartment-flat-for-sale-in-qualitas-extencia-sector-17-ulwe-navi-mumbai-359-sq-ft-spid-L81718330,₹50 Lac,"₹13,927 /sqft",359 sqft,Carpet Area,1 BHK,1  Bath,"Property is on hight, clean view of ulwe from balcony other building hights are short than our flat balcony, amazing wind flow to flat from balconies.
Wider road, near by market, walking distance from kharkoper railway station.",,,,,,,,,,,,,,,,,[],[],[],,{},Ready To Move,
